"Nombre de la categoría","Número ID de la categoría","Nombre completo del curso","Nombre corto del curso","Número ID del curso","Fecha de inicio del curso","Fecha de finalización del curso","Nombre corto del curso con enlace"
"Abiertos Asincrónicos",,"Automatización de Procesos con Power Automate",140,,"lunes, 17 de noviembre de 2025, 00:00","miércoles, 31 de diciembre de 2025, 23:59",140
"Abiertos Asincrónicos",,"Manejo de Excel Nivel Básico",142,,"lunes, 24 de noviembre de 2025, 00:00","domingo, 21 de diciembre de 2025, 23:59",142
"Abiertos Asincrónicos",,"Fundamentos de Gemini IA ",143,,"martes, 25 de noviembre de 2025, 00:00","domingo, 21 de diciembre de 2025, 23:59",143
"Abiertos Asincrónicos",,"Fundamentos de Gemini IA",144,,"martes, 25 de noviembre de 2025, 00:00","domingo, 21 de diciembre de 2025, 23:59",144
"Abiertos Asincrónicos",,Lenguaje,147,,"sábado, 29 de noviembre de 2025, 00:00","lunes, 1 de diciembre de 2025, 13:21",147
"Abiertos Asincrónicos",,"Manejo de Excel Nivel Básico IGLESIA ADVENTISTA",149,,"jueves, 25 de diciembre de 2025, 00:00","viernes, 2 de enero de 2026, 23:59",149
"Abiertos Asincrónicos",,"Manejo de Excel Nivel Básico HOTEL DA",190,,"lunes, 9 de febrero de 2026, 00:00","domingo, 8 de marzo de 2026, 23:59",190
"Abiertos Sincrónicos",,"Power Bi Nivel Básico MOP Dirección Vialidad",70,,"miércoles, 25 de junio de 2025, 00:00","jueves, 9 de julio de 2025, 23:59",70
